{
  "$ref": "#/definitions/tree",
  "definitions": {
    "tree": {
      "type": "object",
      "properties": {
        "type": {
          "type": "string",
          "const": "tree"
        },
        "path": {
          "type": "string"
        },
        "entries": {
          "type": "array",
          "items": {
            "type": "object",
            "properties": {
              "path": {
                "type": "string"
              },
              "name": {
                "type": "string"
              },
              "kind": {
                "type": "string",
                "enum": [
                  "file",
                  "dir"
                ]
              },
              "size": {
                "type": "number"
              },
              "mtime": {
                "type": "number"
              },
              "hasChildren": {
                "type": "boolean"
              }
            },
            "required": [
              "path",
              "name",
              "kind"
            ],
            "additionalProperties": false
          }
        },
        "id": {
          "type": "string"
        },
        "inReplyTo": {
          "type": "string"
        }
      },
      "required": [
        "type",
        "path",
        "entries"
      ],
      "additionalProperties": false
    }
  },
  "$schema": "http://json-schema.org/draft-07/schema#"
}
